{
  "schema_version": "1.0.0",
  "artifact_type": "prd_bundle",
  "prd": {
    "title": "广东移动迭代需求说明202603 — 用例草稿（从 issue-report 导出）",
    "background": "基于《广东移动迭代需求说明202603.pdf》抽取的需求点生成测试用例草稿；需结合原型与接口细化。",
    "goals": [
      "端到端流程：列表/新建/详情/子流程弹窗",
      "工作区绑定：单级/多级模型差异",
      "一致性分析：BPMN 获取与同步最新流程",
      "菜单更名与权限调整正确生效"
    ],
    "users_and_roles": [
      "普通用户（默认查看）",
      "编辑/配置管理用户",
      "无权限用户（验证入口隐藏/禁用）"
    ],
    "scope": {
      "in_scope": [
        "端到端流程（列表/新建/选择流程抽屉/详情/子流程弹窗）",
        "工作区新建绑定端到端/职能流程（单级/多级）",
        "一致性分析设置页（自动获取 BPMN、同步最新流程）",
        "端到端详情页进入分析工作区（权限过滤）",
        "一级菜单更名与顺序调整",
        "权限设置调整"
      ],
      "out_of_scope": [
        "外部模型调用与自动生成（本仓库不提供）"
      ]
    },
    "pages_or_flows": [
      "流程资产 > 端到端流程列表",
      "端到端流程新建（选择流程抽屉）",
      "端到端流程详情（旁支流程/子流程弹窗）",
      "流程分析 > 新建工作区（绑定流程资产）",
      "一致性分析设置页",
      "权限设置与对象列表操作栏",
      "一级菜单栏"
    ],
    "core_interactions": [
      "新建端到端流程并保存跳转详情",
      "选择流程抽屉：选择 L4、拖动排序、两级层级、取消选择",
      "详情展示：主流程箭头与换行、旁支展示",
      "含子流程：打开子流程弹窗",
      "一致性分析：进入设置页自动获取 BPMN、同步最新流程",
      "进入分析工作区：单/多工作区入口与权限过滤",
      "权限配置：新增对象无“权限类型”，在列表操作栏统一配置"
    ],
    "business_rules": [
      "选择流程抽屉可选择已发布 L4 流程",
      "最多支持两级；取消一级后子流程升级为一级",
      "保存后进入端到端详情页",
      "单级模型：一致性分析设置页自动获取最新已发布 BPMN；获取不到提示“未获取到BPMN！”",
      "多级模型：自动获取职能流程列表与 BPMN；匹配规则：层级一致、名称一致、活动需包含子流程",
      "支持“同步最新流程”同步配置至最新版本",
      "端到端详情页进入工作区入口需考虑用户权限",
      "菜单：流程中心更名流程分析并全局替换；菜单顺序调整",
      "权限：新增对象去掉权限类型；默认所有用户查看，不允许编辑/删除；模块权限项差异按需求"
    ],
    "exceptions_and_edge_cases": [
      "BPMN 获取失败/无发布版本/无权限/接口异常",
      "多工作区入口的过滤与提示",
      "同步最新流程的差异提示与回滚（待确认）"
    ],
    "pending_confirmations": [
      "权限矩阵（对象×操作×角色/用户组×继承/独立）细则",
      "BPMN 获取失败后的重试/回退策略",
      "匹配规则容错与重名消歧",
      "同步最新流程的差异提示与回滚策略"
    ]
  },
  "function_list": [],
  "test_points": [],
  "draft_test_cases": [
    {
      "case_title": "端到端流程-新建成功并自动进入详情页",
      "preconditions": [
        "用户拥有端到端流程编辑/管理权限",
        "存在至少 1 个已发布 L4 流程"
      ],
      "steps": [
        "进入 流程资产 > 端到端流程",
        "点击“新建端到端流程”",
        "录入必填信息",
        "打开“选择流程”抽屉选择主流程（可选旁支）",
        "点击保存"
      ],
      "expected_result": "创建成功并自动跳转到端到端详情页，详情页展示所选流程信息。",
      "priority": "P0"
    },
    {
      "case_title": "端到端流程-选择流程抽屉仅允许选择已发布 L4 流程",
      "preconditions": [
        "存在已发布与未发布流程数据（草稿/未发布）"
      ],
      "steps": [
        "新建端到端流程时打开“选择流程”抽屉",
        "查看可选列表并尝试选择未发布流程"
      ],
      "expected_result": "未发布流程不可被选中（不可选或不展示，以原型为准）；已发布 L4 可正常选择。",
      "priority": "P0"
    },
    {
      "case_title": "端到端流程-已选流程拖动排序后保存生效",
      "preconditions": [
        "用户有编辑权限",
        "可选择至少 3 个 L4 流程"
      ],
      "steps": [
        "抽屉选择 3 个流程",
        "拖动调整顺序",
        "保存端到端流程",
        "在详情页核对展示顺序"
      ],
      "expected_result": "详情页主流程展示顺序与保存顺序一致。",
      "priority": "P0"
    },
    {
      "case_title": "端到端流程-取消选择一级流程后子流程升级为一级",
      "preconditions": [
        "用户有编辑权限",
        "可构造两级层级（以原型支持为准）"
      ],
      "steps": [
        "在抽屉构造一级流程与其子流程（两级）",
        "取消选择一级流程",
        "观察子流程层级变化并保存"
      ],
      "expected_result": "一级流程被移除；其子流程自动升级为一级，保存后详情页展示符合升级后的层级。",
      "priority": "P1"
    },
    {
      "case_title": "端到端流程-已选流程悬浮显示路径",
      "preconditions": [
        "已选择至少 1 个流程"
      ],
      "steps": [
        "在已选择流程上悬浮鼠标"
      ],
      "expected_result": "显示路径信息提示（tooltip/浮层）。",
      "priority": "P2"
    },
    {
      "case_title": "端到端详情页-无旁支流程时隐藏旁支模块与分割线",
      "preconditions": [
        "存在仅含主流程的端到端流程"
      ],
      "steps": [
        "进入端到端详情页"
      ],
      "expected_result": "不展示“旁支流程”模块及分割线；布局无空白异常。",
      "priority": "P1"
    },
    {
      "case_title": "端到端详情页-旁支流程按顺序展示且无箭头",
      "preconditions": [
        "存在含旁支流程的端到端流程"
      ],
      "steps": [
        "进入端到端详情页",
        "观察旁支流程展示方式与换行"
      ],
      "expected_result": "旁支流程按顺序依次展示，无箭头；超出一行自动换行。",
      "priority": "P1"
    },
    {
      "case_title": "端到端详情页-含子流程标签打开子流程弹窗",
      "preconditions": [
        "详情页存在“含子流程”标签的流程卡片"
      ],
      "steps": [
        "进入端到端详情页",
        "点击“含子流程”标签"
      ],
      "expected_result": "弹出子流程弹窗，标题为“[子流程名称]·子流程”，内容展示规则与主流程一致。",
      "priority": "P1"
    },
    {
      "case_title": "工作区-多级模型新建工作区绑定端到端流程（单选）",
      "preconditions": [
        "数据模型为多级模型",
        "存在至少 1 条端到端流程",
        "用户有创建/编辑工作区权限"
      ],
      "steps": [
        "新建分析工作区",
        "在绑定区域选择 1 条端到端流程",
        "保存工作区"
      ],
      "expected_result": "工作区创建成功，绑定关系保存成功并可在工作区配置/详情中查看。",
      "priority": "P0"
    },
    {
      "case_title": "工作区-多级模型新建工作区绑定职能流程（L4，多选+拖动）",
      "preconditions": [
        "多级模型",
        "存在多个已发布 L4 流程",
        "用户有权限"
      ],
      "steps": [
        "新建工作区选择绑定职能流程",
        "多选多个 L4",
        "拖动调整顺序",
        "保存"
      ],
      "expected_result": "多选绑定保存成功；顺序与取消选择行为符合原型（取消与左侧取消一致）。",
      "priority": "P1"
    },
    {
      "case_title": "工作区-单级模型绑定职能流程下拉支持检索",
      "preconditions": [
        "单级模型",
        "存在可绑定已发布 L4",
        "用户有权限"
      ],
      "steps": [
        "新建工作区打开职能流程下拉",
        "输入关键字检索",
        "选择结果项并保存"
      ],
      "expected_result": "下拉检索生效；选择并保存成功。",
      "priority": "P2"
    },
    {
      "case_title": "一致性分析-单级模型进入设置页自动获取最新已发布 BPMN",
      "preconditions": [
        "单级模型工作区已绑定 L4",
        "该 L4 存在最新已发布 BPMN"
      ],
      "steps": [
        "进入一致性分析设置页（未分析场景）"
      ],
      "expected_result": "自动获取并展示最新已发布版本 BPMN；页面无异常提示。",
      "priority": "P0"
    },
    {
      "case_title": "一致性分析-单级模型未获取到 BPMN 时弹窗提示",
      "preconditions": [
        "单级模型工作区已绑定 L4",
        "该流程无可获取 BPMN（或模拟接口失败）"
      ],
      "steps": [
        "进入一致性分析设置页（未分析场景）"
      ],
      "expected_result": "弹窗提示“未获取到BPMN！”。",
      "priority": "P0"
    },
    {
      "case_title": "一致性分析-多级模型进入设置页自动获取职能流程列表与 BPMN",
      "preconditions": [
        "多级模型工作区已绑定端到端或职能流程",
        "相关流程存在已发布 BPMN"
      ],
      "steps": [
        "进入一致性分析设置页（未分析场景）"
      ],
      "expected_result": "自动获取并展示职能流程列表及最新已发布 BPMN。",
      "priority": "P1"
    },
    {
      "case_title": "一致性分析-点击同步最新流程后配置同步至最新版",
      "preconditions": [
        "工作区已绑定端到端或 L4",
        "绑定流程已发布新版本（或模拟版本变更）"
      ],
      "steps": [
        "进入一致性分析设置页",
        "点击“同步最新流程”"
      ],
      "expected_result": "配置项同步并刷新为最新版本（差异提示/回滚按待确认补充）。",
      "priority": "P1"
    },
    {
      "case_title": "端到端详情页-有关联工作区时显示“进入分析工作区”并可跳转",
      "preconditions": [
        "端到端流程有关联工作区",
        "用户有进入该工作区权限"
      ],
      "steps": [
        "进入端到端流程详情页",
        "点击“进入分析工作区”】【或对应入口】"
      ],
      "expected_result": "成功进入工作区首页。",
      "priority": "P0"
    },
    {
      "case_title": "端到端详情页-多工作区入口悬浮展示并按权限过滤",
      "preconditions": [
        "端到端流程关联多个工作区",
        "用户仅对其中部分工作区有权限"
      ],
      "steps": [
        "进入端到端详情页",
        "悬浮入口区域查看可进入列表",
        "尝试点击一个有权限与一个无权限的工作区"
      ],
      "expected_result": "仅展示/允许进入有权限的工作区；无权限工作区不展示或不可点击并有提示（以最终规则为准）。",
      "priority": "P2"
    },
    {
      "case_title": "导航-一级菜单更名与顺序调整生效",
      "preconditions": [
        "用户已登录"
      ],
      "steps": [
        "查看一级菜单栏名称与顺序"
      ],
      "expected_result": "菜单顺序为“主页、流程资产、流程分析、数据池”；“流程中心”相关命名已替换为“流程分析”。",
      "priority": "P1"
    },
    {
      "case_title": "权限-新增对象不展示权限类型，权限在列表操作栏统一配置",
      "preconditions": [
        "选择一个支持权限管理的对象类型",
        "用户具备配置管理权限"
      ],
      "steps": [
        "进入对象列表点击新增",
        "检查新增表单是否包含“权限类型”",
        "新增成功后在列表操作栏进入权限配置"
      ],
      "expected_result": "新增表单不展示“权限类型”；列表操作栏提供权限配置入口且可配置成功。",
      "priority": "P0"
    }
  ]
}
