{
  "schema_version": "1.0.0",
  "artifact_type": "prd_bundle",
  "prd": {
    "title": "登录功能 PRD",
    "background": "支持用户进入系统。",
    "goals": [],
    "users_and_roles": [],
    "scope": {
      "in_scope": [],
      "out_of_scope": []
    },
    "pages_or_flows": [],
    "core_interactions": [],
    "business_rules": [],
    "exceptions_and_edge_cases": [],
    "pending_confirmations": []
  },
  "function_list": [],
  "test_points": [],
  "draft_test_cases": []
}
